1118505866804610000,"So why is it that lying Christine Blasey Ford, the woman who single-handedly killed the #MeToo movement, being honored by @TIME? Is it because they like to promote liars who push their narratives?",M,N
1118506539835360000,"W/A at #FAMConf: Has the climate changed for women in mfg?  The #MeToo movement may have  made mgmt more mindful, but it does not foster attitudes of entitlement. It does foster respect for talented women. #WomenInManufacturing #WomenInSTEM @500womensci",F,N
1118514453761290000,The #MeToo movement is changing the way women run companies. https://t.co/m6MlBLpXv3,F,N
1118520247831680000,"Let’s fight against modern day slavery of women who are beaten and raped since 9. All the #MeToo movement. Where are you with this one?  What ever happened to your Hollywood Weinstein?  By follow up on this?  $$$ makes it all go away. So if #metoo is good, they will say much more",F,N
1118527801869650000,How do you feel about mandatory #sexualharassment training being introduced into UK businesses? It's a step-forward for the #metoo movement surely - https://t.co/4jROC0c1Qb,F,N
1118528701422080000,No surprise: weaponizing sexual assault allegations for political gain has damaged the much needed #MeToo movement and hurt victims of sexual assault in the long run.  https://t.co/H9nUuElYmr,F,F
1118530466162910000,"Today @EuroLabour MEPs pledged to #MeToo in @Europarl_EN -well done to hard working staff and members of @MeTooEP who have carried this movement. 
We pledge to many things including ending the culture of silence and to combat sexism and sexual harassment.
https://t.co/IVftu1DfP2 https://t.co/zrpZplrFR1",F,F
1118534420049410000,#CUDM19 #MeToo is a movement to speak out against sexual assault/harassment. This movement involves both men and women.,M,N
1118535337805010000,"“The #MeToo movement has given us new ways to think about female icons like Helen [of Troy] or Marilyn Monroe, new ways to revolve the traditional male version of such events 360 degrees and find different, deeper sorrows there.” — Anne Carson https://t.co/WlfbCHTX3h",M,F
1118535955542150000,Loved learning about how the #metoo movement has been growing since its founding and how it has combated against sexual abuse. #CUDM19,M,F
1118536411571990000,I’m so tired of this mf’n #MeToo movement. These bitches are doing the most. Ugh...,F,A
1118539661893300000,"The #MeToo movement may have put Gender #Equality in the spotlight, but the facts show that we still have a long way to go. With #Goal5 of @GlobalGoalsUN, we can eradicate prejudice and work for equal rights and respect for all. #GlobalGoals https://t.co/W8Jm5MhXSl",M,F
1118541699532220000,Somehow the #metoo movement gives  women any reason to bash men and be fine with it,M,A
1118542760485820000,"Any outlet continuing the fuel the Ford story, thus politicizing the justice movement of #MeToo which must remain nonpartisan in order to be effective, is actively harming victims' abilities to be believed. https://t.co/hz0liU7XMr https://t.co/ylIvQEobJd",F,F
1118544828357400000,"The #MeToo movement has created an interest in female directors in China
""Here I am the intelligent type
Don't tell me that it's wrong or I will put you right""
from Don't Call Me Babe https://t.co/ThB4apfQ88
 https://t.co/RNASaR67Vb",F,F
1118553422322700000,Me2 The #MeToo movement matters. Show your support by downloading the MNFST app and join the movement today 🚀 https://t.co/9Vfhd6iNMh https://t.co/YmABlFWdT9,M,F
1118554805356640000,A liar is the face of #MeToo. No wonder the movement has been losing steam ever since. https://t.co/OghVIc85pr,M,N
1118555392626260000,"Liberal Democrats attacked #Kavanaugh over a bogus 35 yo HS baloney, fire up #MeToo movement.

Yet not a PEEP about #MichaelAvenatti &amp; so many other libs in Hollywood, Democrat party, etc.  #LiberalHypocrisy https://t.co/tN04ubtR2H",F,A
1118563607405630000,"Hey Y'all! Here's an opportunity to aid the #MeToo movement while aiding a Police Officer AND saving her dog! Please sign and pass it on. It will mean so much to my friend Melissa, her cousin, and Xena the K9! XO https://t.co/yG94PFFECC",F,F
1118564954116950000,"This is like a stab in the heart of real victims. The #MeToo movement will be destroyed if they keep on pushing this BS, true victims are at risk. https://t.co/Xs9DeDXtXq",F,F
1118566278522910000,"""While the situation has almost certainly improved, even in the last 18 months since the popularisation of the #MeToo movement, there are still a number of steps that workplaces need to take to improve their working culture."" @hephzipemberton 
#EqualityGroup #Diversity #Inclusion https://t.co/558Zv1ji3W",M,F
1118572435220120000,What a slap in the face to the  #MeToo movement. https://t.co/e8UO7mUDfb,F,N
1118591255708100000,"I’m watching Beverly Hills, 90210 (on season 4 so no spoilers) and I can’t believe how many issues they cover that are still so controversial and prevalent today. Gun control. #MeToo  movement. Everything is so topical, not dated at all. We haven’t made that much progress.",F,F
1118601036711830000,Still waiting for @Rialisms to prove me wrong about how she isn’t giving a bad rep to the #metoo movement https://t.co/lIQbKh2mY6,F,N
1118604106321550000,I totally get why Christine Blasey Ford made it into the #Time100. She had a lot of influence in killing the #MeToo movement.,F,N
1118606811840560000,"Dramatic rise in suicides amongst men of all ages, especially our youth.

In this day and age of the #metoo movement men are having to re-examine who they are, what their purpose is and how they can serve the... https://t.co/okKHjLIuh1",M,N
1118627118240480000,It's crazy @Sony is like this with @PlayStation as the #metoo movement is full of cosplayers showing there tits &amp; ass everywhere  selling sexy photos while still complaining about how women are depicted in video games uh honey if that stops you won't have cosplays to do you idiot https://t.co/ECSH6xWwf4,F,A
1118629957062680000,The #metoo movement ended the instant that Tiger sunk that last ball to win the title.,F,N
1118633898261370000,"""It would be awful if one of the unintended consequences of the #metoo movement is that employers are now so paranoid of being sued, they’re quietly blackballing the victims who had the strength and courage to stand up for themselves.""  https://t.co/w1uAoTLBuX",F,N
1118639804219110000,The same magazine that named the women of the #MeToo movement as its person of the year. How do you list Dr. Christine Blasey Ford and Brett Kavanaugh on the same list? #TIME100 https://t.co/z0CJwYPMaB,F,F
1118661968666270000,"“When something happens—even wars—it’s over. This will never be over. This is a point in #culture, in #society—no person can come out of the last year and treat people the same way.” —@CBS's Susan Zirinsky on the #MeToo movement. https://t.co/4UGW4Zqik5",M,N
1118665483434300000,The #MeToo movement is about accountability both for sexual harassers AND for institutions and leaders who enable them. The Maricopa County Attorney’s Office has failed on both fronts. Bill Montgomery must resign. #NoMoreMontgomery #AZWomenDeserveBetter https://t.co/x3lO0b3FdZ,F,F
1118673948592550000,When your absolute garbage-on-fire family members make fun of the millions of survivors of the #metoo movement https://t.co/xmTPyXfprh,F,F
1118682582487590000,This is exactly how the #MeToo movement lost so much credibility last year. https://t.co/cN2LVZZJ9W,M,N
1118712245217890000,Can confirm that the #metoo movement has yet to reach the gays of the service industry,M,N
1118737495057820000,#metoo at times I wonder if a meetoo type of a movement is possible against corruption also in India. Anyone reading this tweet please spread the message. Corruption is a deep scourge that plagues our society. Join the campaign. https://t.co/sS41m1P4VY,F,F
1118750679554760000,"As for the #MeToo era and what society believes it has become. 

Due to the patriarchy and its influence on our society, I believe many people consider the #MeToo movement to be TOO MUCH. Too many. Too honest. Too... https://t.co/t3eobRpIBH",F,F
1118759546955140000,"Go away @LucyFlores. The #metoo⁠ ⁠ movement is so much more than you and your political opinions. Stop acting like you speak for everyone. Your 15 mins of fame is up. Bye Felicia! 
#feelthebern",F,F
1118781236984600000,Appalling. In case we needed another reminder that the #MeToo movement needs to be truly global https://t.co/4wuyVR2wPn,F,F
1118799096184230000,My last blog was so hard for me to type but even harder to publish. Letting that huge part of myself out into the world is scary but freeing. I was so afraid during the #metoo movement to come out about my experiences but the power of others helped me to do this now. ❤️,F,F
1118828956587830000,"Respecting female boundaries seems to be a great challenge nowadays, especially when the legal def. of sex is contested worldwide. I'm no fan of some outcomes the #MeToo movement has unleashed in the West but there're fundamental issues we need to act on.
https://t.co/mUh720d64r",F,N
1118829336994300000,"If you question the legitimacy of claims made in the #MeToo movement, this story shows the severe consequences of reporting abuse! This is why it takes many years for victims to have the courage to speak up, if ever! https://t.co/6fGimsUer4",M,F
1118863972734840000,DISGUSTED @SenSanders how YOU &amp; main stream media have worked tirelessly to portray #MeToo merely as a sexual harassment &amp; women's rights movement. Isn't issue of abuse of power in the work place SO MUCH LARGER? #HouseCatAsks @DNC @GOP KAT @SenWhitehouse DH @cindymccain #1KAT https://t.co/7ENMRwGTIc,M,F
1118880344051200000,"The @cpsuk should be basing things on reality, not perpetuallting rape myths that enable perpetrators. And do say that women are empowered to report by the #metoo movement. The #metoo movement is a result of our lack of faith in the justice system!! https://t.co/n7pOmR8Wrt",F,F
1118886308351490000,"Mikayla Edris, Women’s Soccer

“I believe the biggest platform to reach people on sexual assault prevention is social media. The #METOO movement has done a good job bringing awareness to this topic”

#NCAAStudentAthleteInAction https://t.co/VD3L5JeTt1",F,F
1118888152079450000,"#metoo hasn’t penetrated into A LOT of spaces. I tried 2 explain why #muteRkelly was a movement 2 some teens &amp; in their neighborhood predatory behavior is normal, expected &amp; encouraged. The girls couldn’t fathom a place where a 14yr old wasn’t completely responsible 4 her safety. https://t.co/lf9se4wyhi",F,F
1118892028883100000,"the #metoo movement is important, but also: 
exhausting, exacting, 
a gendered endurance test i have to remind myself i'm taking
every night before bed, more nightmares (new ones - who knew
there could still be new ones!), unkind,
un-loving, ""truth hurts"", un-quiet - Pray!",M,F
1118905821625240000,Help support the #MeToo movement and share your sexual harassment/ rape story with others for support. We are all in this together!! Use the hashtag and spread love.,M,F
1118906527937700000,#MeToo history: This movement was started by Tarana Burke in 2006 to give a safe space for women who are being treated wrong to share their story and get support. The word really got out when Alyssa Milano used the hashtag on twitter one day. From then on it went viral!!,M,N
1118907297512800000,"More than a year after the #MeToo movement went mainstream, progress is apparent, but what does the legal landscape look like for survivors demanding justice, and the advocates fighting for them? https://t.co/kHUr5vw7Li",F,N
1118910813970920000,"The #MeToo movement has grown into creating and structuring real change in the workplace. Smart business owners will be prepared to respond to and work with #MeToo in order to implement much-needed redevelopment of policies. 
https://t.co/4ZLLxD7rp5",F,F
1118915532508370000,"I spoke up. didn’t sue. Didn’t get a dime. Didn’t join class action suites. Didn’t benefit in any way from telling my story. Yet while searching for a job I’m told “you make people nervous.”
Unfortunately this is the fallout of the #MeToo movement  https://t.co/BtZG6VInJt",F,F
1118928026077550000,"ok but a witch hunt was a sexist movement that stemmed from desire to control women... Trump has used “witch hunt” to describe the #MeToo movement. let’s not use that phrase because this is an investigation on basis, not irrational/sexist fear. https://t.co/QRx9uiZBje",F,F
1118933440336890000,"CAN-International #metoo moment, that caused a suicide

""This was a movement for a fairer, safer world. Yet eager recruits found themselves in an unjust, hostile workplace, with no protection.""

https://t.co/URaRaXrOrs",F,N
1118938892390940000,"So the #metoo movement is really just a ploy to grab power via the #victimcard Case in point, it recently came out that Cardi B drugged, robbed and might have even raped 1 victim and she is still free to carry on in her career. Even @CNBC is cool with her https://t.co/HHXmkypPKY",M,A
1118948856215920000,"Aunt posted an article about the ""War [against] men."" [vomit emoji] Paraphrased from the article: ""Sure the #metoo movement exposed a lot of horrible acts, but what about the men who are the casualties of this whole thing""",M,F
1118950727244760000,"Whatever you think about #MeToo, the very worst of that movement is much better than this https://t.co/v88h2siLds",M,F
1118952572952420000,"The #MeToo movement has created a ""safe enviroment"" for more girls to come forward and speak about things that they experienced as teenagers. Read some great tips on how to handle a conversation with your child if they step forward making a #metoo claim. https://t.co/2oL3EKbF9r https://t.co/lrZLCIoK4b",F,F
1118955090755370000,"As someone who has no choice but to be part of the #MeToo movement, stop being such fucking dumbasses and think about how this looks to other kids who want to say the same. You've harangued and abused me the same as my oppressors. Fuck you, pay me.",F,N
1118957463825530000,"The #metoo movement fucked up every thing for lazy whores like me,a quick nut and poof I'm a star.... https://t.co/5MSLmGWnwl",F,A
1118982230611760000,"Found it heartening post the #metoo movement to learn of on set ""intimacy co-ordinators"" today. Choreographing intimate scenes, safeguarding all parties involved and helping to keep the boundary between the personal and professional.  https://t.co/6vxZO12R8f",F,F
1118982699723690000,All they care about is the movement that’s it ! They have a strong loyalty  an investment a so called pledge slash sacrifice to this movement called #metoo and #TimesUp that they will lie and set people up to make themselves stronger,M,N
1118990629508460000,"Is the #MeToo movement a joke?

https://t.co/iE9TdkHoZa",M,N
1118994008934630000,They were busy doing things that finally promoted the #MeToo movement. https://t.co/YhRyago6q9,M,F
1119003765607220000,I’ve spent a lot of time this semester studying (and teaching) the Civil Rights Movement and it makes me wonder how future historians will look at the #MeToo Movement,F,N
1119006175239050000,sick to my stomach this needs as much outrage as the rest of the #MeToo movement https://t.co/9EKD5p5aea,F,F
1119023608700000000,So when people say #metoo movement isn't important and women's rights shouldn't be at the forefront of #GlobalGoals this is why! This is heartbreaking.. https://t.co/0muc5fjfSp,F,F
1119030919434780000,"Men shouldn’t think about the #metoo movement like “I’m so scared that I’m going to be wrongly accused of something.” Instead they should think about it like “I didn’t realize there were things that men do that make women uncomfortable. Now I know, and I won’t do those things.”",F,F
1119032595004780000,“There’s a place in the movement for both women and men.” #metoo #metooHBCU,M,F
1119032645432820000,Of course!! This asshole gets no scrutiny from the media &amp; no coverage!! They're using #MichaelJackson as a scapegoat for #meToo movement in place of the real predators.. I don't see @GayleKing &amp; @Oprah interviewing him!!?? #muteoprah #LeavingNeverlandLies https://t.co/Qurun9K44q,F,F
1119039178623210000,"Don’t ever take women’s rights for granted. The #MeToo movement must work on an International level, someway, somehow. https://t.co/ubX64t7LSX",M,F
1119041145026360000,this is exactly why I have a zero sympathy for these certain women and #metoo fake movement...  not all women are bad it's just the select few that ruin it for all. https://t.co/KIemrNE8eR,M,A
1119048654759900000,The Muslim #MeToo movement hasn't gained as much traction yet. Keep trying ladies! https://t.co/QSlQYlNIrG,F,F
1119051688290090000,It’s not that I don’t understand why this happens it’s that it happens I can’t digest. A young girl set on fire for speaking up about sexual assault by headmaster. I blame men but also woman in #metoo movement who didn’t make space for girls like Nusrat.  https://t.co/VMrneZclB2,F,F
1119052405113530000,Are we really supposed to under go a transition of our social norms as men due to the #metoo movement and modern feminism?,F,A
1119070925079630000,"The #metoo movement is a product of @HillaryClinton first crying and losing to @BarackObama, then doubling down with a loss to @realDonaldTrump because her email server went missing. Women had to do something about it. #NotMe",M,A
1119075065604110000,And people wonder why we need a #metoo movement 😢 https://t.co/X2GB1XudWO,F,F
1119075422380140000,"Women in the lowest paid jobs to the highest paid jobs have been retaliated against &amp; ""blacklisted."" This is not a new practice &amp; the #MeToo movement is certainly not at fault. The fault is squarely on those who violate the law- so should be the blame &amp; consequences. Read more: https://t.co/5VJbc5LvmA",F,F
1119083105371900000,"“The #MeToo movement ruined careers”.

I just want to send this tweet back in time to every single asshole who said the above to me, along with a short personal note: 

“fuck ALL the way off all over again, motherfucker”. 

THEN point and laugh at their Stupid. Once again. https://t.co/Col7igXKmZ",F,F
1119106484548160000,To get likes just tweet trends like #metoo and #ClimateChange. Its like joining the bandwagon though. #ASIC allows investment banks like #UBS to rob billions off us through the manipulation of share prices. We need another movement #ausbiz #auspol #Ausvotes #michaelwestbiz #AFR,M,N
1119126527780610000,Tony Stark would have been destroyed by the #MeToo movement tbh #IronMan #MCUMarathon,M,N
1119136199023580000,Well Sadhvi is trying to say that Priyanka should continue to do work with the people who misbehaved with her and the organization supports the goon instead of her. So much for #MeToo movement. https://t.co/d3CwtXz3ik,F,N
1119137136437900000,"""I reiterate that I am extremely sensitive to the #MeToo movement. But when circumstances are beyond me, I don't see why an attempt is being made to `single' me out as being insensitive.” says @ajaydevgn on working with #AlokNath in #DeDePyaarDe: https://t.co/JqzRYfNK1I https://t.co/8Yt1KNq64e",F,N
1119146560183390000,"What is disgusting it to see these feminists from #metoo movement approving the mockumentary ""Leaving Neverland"" even thought it is already debunked many times. What you wish to do is sending an innocent man to jail, shame on you.",F,A
1119164160489580000,this is why the #MeToo movement is so important https://t.co/RSIspubeWZ,M,F
1119168889949230000,Where is the #metoo movement now?................crickets. https://t.co/0R2IctInP1,M,N
1119187291929500000,"Oh dear Oh dear. 007 is dead. James Bond is being reshaped for the feminist #metoo movement. The first issue they are going to tackle is his womanizing. Hold on a minute, did they jump into bed with him too. Was he not supposed to be irresistible to women #notmydoctor",M,A
1119199985621450000,"Much of World History is a footnote to the Adam and Eve story. 

Women for eons have been manipulative, dishonest, crazy. Witness the #MeToo movement and Kavanaugh hearings.

Should Women pass mental health/ethics testing to vote and hold office? 

I say Yes.

#FreeSpeechFriday",M,A
1119209212024890000,This week’s #FeministFriday features founder of the #MeToo movement #TaranaBurke. Burke began using the phrase to raise awareness about the prevalence of sexual abuse in society. The movement has become a space where survivors can regain their power and find community #MeToo https://t.co/Z3Q2QENkUp,F,F
1119209215741110000,"#MeToo is a #movement that has touched many women, today I'm gathering strenght to #TellTheTruth and be free of this part of my life. 
#bloggerstribe #today #MyStoryMatters #blogger #newblog #MeToo https://t.co/jyuJSHC7DX",M,F
1119218133867410000,"With advent of the #MeToo movement , there should be no statue of limitations on sexual abuse, sexual harassment and rape, hate crimes or the denial of ones freedom under the law. https://t.co/CbX9Kw7Ssi",M,F
1119224151523370000,"Just saying if you’re willing to post something about women’s rights and the #metoo movement, you better fucking back it up in person. Do not claim to support girls when all you do is tear them down.",F,F
1119233650825070000,"For those who try to discredit the #metoo movement, the inklings of your ignorance empower the hatred behind atrocities like this one. #RIP https://t.co/fuLYKNQMmb",M,F
1119243654722280000,Absolutely disgusted and so sad that this happened. More reason the #MeToo movement is so important! https://t.co/ipjl3q6Hp9,F,F
1119246606270810000,The most refreshing thing about reading @halseanderson’s interviews about SHOUT is that she always gives credit to @TaranaBurke for starting the #MeToo movement when it’s mentioned and that’s just... so nice and not done often enough,F,F
1119246715952010000,"If there are some women who are a fan of the #MeToo movement, this is the biggest challenge yet. 

May her soul rest in peace for doing the right thing. She doesnt deserve this. https://t.co/PObKz2lhjq",M,N
1119249764648940000,"#MeToo When does the #MuteDrDre movement begin? He’s a serial abuser whose gone on to make billions after this public violent assault and offered a weak ass apology YEARS later &amp; ended Dee Barnes’ career.
https://t.co/rRS1vUWnsZ",F,N
1119257206950470000,Those supporting the #metoo movement have let down Sadhvi Pragra  @SadhviPragya19,F,A
1119272092304910000,"Yeah and we saw that a lot lately due to the #metoo movement. And not only pouring hatred, but some women will blame the victim #victimblaming #sisterhood  #Youthtakeover #womenforwomen #WomenSupportingWomen #hersuccessisnotmyfailure #girlove https://t.co/KLdRGdcZ1Y",M,N
1119277560976890000,"This ""pound me too"" movement is losing credibility everyday.  It is becoming nothing but a weapon for the progressive left.  #metoo",M,F
1119293731096680000,"In #MeToo movement, fake feminists forced us to believe 20-30 years old stories &amp; demanded to completely destroy the credibility/career of the accused &amp; almost make that person as an untouchable without any evidence, but Sadhvi doesn’t have the right to even curse her abuser?",F,A
1119293738889530000,one more thing i just wish ppl would REALIZE the men r trash movement is basically the #metoo movement so get that thru ur thick ass skulls,F,N
1119297833243380000,"Daily reminder that #metoo  movement leader @SenGillibrand made millions as a partner of Boies Schiller &amp; Flexner, the democrat law firm that enabled Harvey Weinstein &amp; hired thugs to terrorize and silence his victims. That law firm is one of her biggest donors. https://t.co/U3M4AQko3W",M,F
1119298779969090000,12.2: A big example (and important one for me- as a woman) is the #metoo movement. This one is huge on many social media platforms and has really helped connect/empower women all around the world #GNED1411,F,F
1119305169282440000,"The #MeToo movement has sparked important conversations about holding abusers accountable—but to fight sexual violence in the long run, we have to do a better job of teaching students about the importance of affirmative, enthusiastic consent. #YesMeansYes https://t.co/sg85fnMukh",F,F
1119332838510170000,That you compare the #MeToo movement to politics &amp; politicking is sickening. Makes me feel sick. Nothing ‘true’ in that comparison; a false equivalence. https://t.co/adox6XxJjQ,F,F
1119342959906970000,I’m all for the #MeToo movement and all the women empowerment groups but I definitely feel like some women are taking advantage of it since it’s being taking so seriously these days,F,F
1119354513578530000,"#day19 of #30daysofSAAM 

When I'm at events, I usually have a person or two who think the movement has gone too far. Or the lives of innocent young men will be ruined now that #metoo is… https://t.co/QSFgHMyB5l",M,N
1119368729626910000,"If Zi agree with someone, Zi say ""me as well"" to respect the #MeToo movement.",F,N
1119378961534990000,"In fairness, the whole #MeToo movement started with him and he’s gotten zero recognition for that 🙄 🐖 https://t.co/N5Hqdw9vEH",F,N
1119381174885870000,"I guess that #MeToo movement isn't going well in Muslim Countries.

The religion of tolerance and peace strikes again!!!!

Muslim Woman Burned to Death for Reporting Sexual Assault | Breitbart https://t.co/9BiwX3qJdI via @BreitbartNews",F,N
1119388488263260000,"#SusanCollins is the same dipshit that gave an egoistic sadistic speech that was in favor of an abusive attempted rapist at the height of the #MeToo movement. Her legacy and the soon to be lifetime movie about her life should be called, ""UNFLATTERING: The Susan Collins Story!!!!""",F,F
